Catalog#,Artist,Title,Label,Format,Rating,Released,release_id,CollectionFolder,Date Added,Collection Media Condition,Collection Sleeve Condition,Collection Notes
K 46177,Alice Cooper,Love It To Death,Warner Bros. Records,"LP, Album, RE",5,1972,3711154,Uncategorized,2024-02-13 23:18:33,,,
R1 681029,Alice Cooper,School's Out,"Warner Records, Rhino Records (2)","LP, Album, RE, RM + 2xLP + Dlx, 50t",5,2023,27342996,Uncategorized,2023-06-10 09:43:14,,,
"R1 681028, 603497841011, R1 681028 / 603497841011",Alice Cooper,Killer,"Warner Records, Warner Records Inc., Rhino Entertainment Company","LP, Album, RE, RM + 2xLP + Dlx, 50t",5,2023,27375900,Uncategorized,2024-02-02 00:28:49,,,
9362-47450-2,Various,Eyes Wide Shut (Music From The Motion Picture),"Warner Sunset Records, Reprise Records","CD, Album",,1999,863671,Uncategorized,2025-07-24 23:55:59,,,
950642,Elvis Presley,Elvis Is Back,WaxTime In Color,"LP, Album, Ltd, RE, Ora",,2013,12687373,Uncategorized,2024-06-05 08:41:03,,,
