Catalog#,Artist,Title,Label,Format,Rating,Released,release_id,CollectionFolder,Date Added,Collection Media Condition,Collection Sleeve Condition,Collection Notes
350232,Elvis Presley,Elvis Presley,20th Century Masterworks,"LP, Album, Ltd, RE, Gre",,2023,26504603,Uncategorized,2024-06-05 08:41:21,,,
CAD 2901,Bauhaus,In The Flat Field,4AD,"LP, Album, RE",,0,16005957,Uncategorized,2025-01-24 05:49:53,,,
0018771953913,The Rolling Stones,Beggars Banquet,ABKCO,"LP, Album, RE, 180",,2017,11215966,Uncategorized,2024-10-30 09:48:49,,,
8584-1,The Rolling Stones,Let It Bleed,ABKCO,"LP, Album, RE, RM, 50t",,2019,14437432,Uncategorized,2024-10-30 09:45:27,,,
2188-1,Various,Priscilla (Original Motion Picture Soundtrack),"ABKCO Music And Records, Inc.","LP, Comp",,2024,30092240,Uncategorized,2024-06-05 08:40:40,,,
19075865591,System Of A Down,Toxicity,American Recordings,"LP, Album, RE",5,2018,12642678,Uncategorized,2024-02-13 23:12:11,,,
0602567703327,John Lennon,Imagine,Apple Records,"LP, Album, RE + LP + RM, GZ ",,2018,12611494,Uncategorized,2024-10-10 08:54:14,,,
"0094638246619, PCS 7067/8",The Beatles,The Beatles  - Anniversary Edition,"Apple Records, Apple Records","2xLP, Album, RE, 180",5,2019,17476018,Uncategorized,2023-02-04 11:07:15,,,
"0602458129526, 45-R 5812952, 5812952",The Beatles,Now And Then / Love Me Do,"Apple Records, Parlophone, Universal Music Group International, Apple Records","12"", Single",5,2023,28789084,Uncategorized,2023-11-27 03:23:24,,,
0602445599707,The Beatles,Revolver,"Apple Records, Universal Music Group International","LP, Album, Pic, RE, RM",5,2022,24967525,Uncategorized,2023-03-18 03:40:54,,,
0602507138653,The Beatles,Let It Be,"Apple Records, Universal Music Group International","LP, Album, RE, Rem",5,2021,20599078,Uncategorized,2023-07-07 00:32:35,,,
"0602577915123, 7791512",The Beatles,Abbey Road,"Apple Records, Universal Music Group International, Apple Records","LP, Album, RE, RM, Rem",5,2019,14186441,Uncategorized,2023-05-29 09:01:07,,,
"0602567098348, PCS 7027",The Beatles,Sgt. Pepper's Lonely Hearts Club Band,"Apple Records, Universal Music Group International, Parlophone, Parlophone","LP, Album, RE, New",5,2017,11281442,Uncategorized,2024-02-13 05:51:13,,,
8122-79657-7,Led Zeppelin,Untitled,Atlantic,"LP, Album, RE, RM, Gat",,2020,18861868,Uncategorized,2025-01-02 02:32:54,,,
8122796576,Led Zeppelin,Led Zeppelin III,Atlantic,"LP, Album, RE",5,0,24805355,Uncategorized,2023-03-30 11:13:01,,,
075678626654,Silk Sonic,An Evening With Silk Sonic,"Atlantic, Aftermath Entertainment","LP, Album, Ltd, RE, Bro",,2024,29724205,Uncategorized,2024-12-23 00:37:05,,,
"8122796573, 8122-79657-3",Led Zeppelin,Houses Of The Holy,"Atlantic, Atlantic","LP, Album, RE, RM, 180",,2014,6224441,Uncategorized,2024-12-30 23:48:30,,,
"8122796640, R1 535225",Led Zeppelin,Led Zeppelin II,"Atlantic, Atlantic","LP, Album, RE, RM, 180",,2020,19502752,Uncategorized,2024-12-30 23:48:55,,,
"8122796641, R1 535224",Led Zeppelin,Led Zeppelin,"Atlantic, Atlantic","LP, Album, RE, RM, 180",5,2020,19887778,Uncategorized,2024-02-28 08:41:32,,,
586 029-2,Barbara (5),Vol. 3,"Back ULM, Universal","CD, Comp, RE, Dig",,2001,9293980,Uncategorized,2025-05-17 07:28:54,,,
378 710-5,Carla Bruni,Quelqu'un M'a Dit,Barclay,"CD, Album",4,2002,11705328,Uncategorized,2022-12-09 03:28:23,,,
673774-6,Feu ! Chatterton,L'Oiseleur,Barclay,"CD, Album, Dig",4,2018,11688972,Uncategorized,2022-12-09 04:29:50,,,
9837321,Gotan Project,Lunático,Barclay,"CD, Album, Dig",,2006,928842,Uncategorized,2025-05-17 06:05:56,,,
"483 696 9, 483 696 0",Stephan Eicher,Ode,"Barclay, Barclay, Electric Unicorn Music Production, Electric Unicorn Music Production, Universal Music France, Universal Music France","CD, Album",3,2022,25041010,Uncategorized,2022-12-09 04:33:26,,,
"BEC5612597, BEC5772052",Charlotte Gainsbourg,5:55,"Because Music, Because Music","2xLP, Album, RE, 180",4,2023,29073616,Uncategorized,2024-03-27 04:41:39,,,
BELLA1289V,Beach House,Once Twice Melody,Bella Union,"2xLP, Album, Sil",4,2022,23270783,Uncategorized,2024-01-13 01:27:57,,,
WIKAD 210,The Cramps,Big Beat From Badsville,Big Beat Records,"LP, Album, RE, Whi",,2013,4606818,Uncategorized,2025-02-10 11:52:57,,,
RKIDLP125X,Oasis (2),Definitely Maybe,Big Brother,"2xLP, Album, RE, RM + 2xLP, Comp + Dlx, Ltd, 30t",,2024,31592299,Uncategorized,2025-07-08 00:33:35,,,
88697722672,Oasis (2),Time Flies... 1994-2009,"Big Brother, Sony Music","2xCD, Comp",,2010,3672495,Uncategorized,2025-07-12 02:18:16,,,
"BB182LP, IDOLLP148, ZOD 014",La Femme (4),Rock Machine,"Born Bad Records, IDOL (2), Disque Pointu","LP, Album",,2024,32175270,Uncategorized,2025-07-17 23:54:03,,,
00602557393149,Various,Saturday Night Fever (The Original Movie Sound Track),Capitol Records,"2xLP, Album, Comp, RE, 180",,2017,10316646,Uncategorized,2025-02-04 09:39:47,,,
00602557537574,Mazzy Star,So Tonight That I Might See,Capitol Records,"LP, Album, RE",5,2022,22739777,Uncategorized,2023-02-04 11:08:17,,,
602465958898,The Cramps,Songs The Lord Taught Us,Capitol Records,"LP, Album, Ltd, RE, Bla",,2024,32574237,Uncategorized,2025-02-10 11:53:27,,,
"0094638246510, 2835",The Beatles,Magical Mystery Tour,"Capitol Records, Apple Records, Capitol Records, Apple Records","LP, Album, RE, RM, 180",5,2012,4058439,Uncategorized,2024-01-12 10:04:35,,,
00602577692413,Beck,Hyperspace,"Capitol Records, Fonograf (3)","CD, Album",5,2019,14437275,Uncategorized,2022-12-22 14:46:18,,,
00602577692529,Beck,Hyperspace,"Capitol Records, Fonograf (3)","LP, Album, Red",4,2019,14433033,Uncategorized,2023-01-28 08:36:15,,,
"61240, S 61240, (MS 7013)","George Gershwin, Philippe Entremont / Eugene Ormandy / The Philadelphia Orchestra",Rhapsody In Blue • Concerto In F,"CBS Classics, CBS Classics, CBS Classics",LP,,1971,5743865,Uncategorized,2025-03-07 23:13:34,,,
"S 70097, CBS 70097",Orchestra Dell'Accademia Nazionale Di Santa Cecilia direction: Franco Mannino,Mort A Venise (Bande Originale Du Film),"CBS, CBS",LP,,0,3207051,Uncategorized,2025-03-07 23:26:30,,,
88697978251,Janis Joplin,Pearl,Columbia,"LP, Album, RE",,2020,15469496,Uncategorized,2024-04-20 01:46:34,,,
"19075981971, C-229826",Various,Once Upon A Time In Hollywood (Original Motion Picture Soundtrack),"Columbia, Columbia","2xLP, Comp, Ltd, Ora",4,2019,14299390,Uncategorized,2023-04-26 10:34:44,,,
19658773731,Daft Punk,Random Access Memories (10th Anniversary Edition),"Columbia, Legacy, Sony Music","3xLP, Album, RE, 180",5,2023,27031743,Uncategorized,2023-05-12 07:32:36,,,
19658808331,Daft Punk,Random Access Memories (Drumless Edition),"Columbia, Legacy, Sony Music","2xLP, Album, 180",5,2023,28924120,Uncategorized,2023-12-01 01:10:26,,,
88875111921,Miles Davis,Kind Of Blue,"Columbia, Legacy, Sony Music","LP, Album, RE, RP, 180",,2015,7606066,Uncategorized,2024-04-20 01:45:57,,,
19802876231,Pink Floyd,Pink Floyd At Pompeii MCMLXXII,"Columbia, Sony Music","2xLP, Album, Gat",,2025,33849456,Uncategorized,2025-05-01 02:55:46,,,
"COLBR76259, 19802876259",Pink Floyd,Pink Floyd At Pompeii MCMLXXII,"Columbia, Sony Music","Blu-ray, RE, RM, Multichannel",,2025,33342602,Uncategorized,2025-05-10 01:11:35,,,
"00602577427664, 00622577427664",Billie Eilish,"When We All Fall Asleep, Where Do We Go?","Darkroom (4), Interscope Records","LP, Album, RE, Yel",,0,29322373,Uncategorized,2024-05-23 09:11:33,,,
602465270525,Billie Eilish,Hit Me Hard And Soft,"Darkroom (4), Interscope Records","LP, Album, Ltd, Blu",,2024,30691885,Uncategorized,2024-05-21 08:30:24,,,
"B0033890-01, B0033778-01",Billie Eilish,Happier Than Ever,"Darkroom (4), Interscope Records, Darkroom (4), Interscope Records","2xLP, Album, Ltd, Bro",4,2021,19676632,Uncategorized,2023-04-19 01:14:13,,,
DMOO060,Miles Davis,Sketches Of Spain,Destination Moon (3),"LP, Album, RE, Cle",,2024,30950020,Uncategorized,2024-09-27 09:05:54,,,
4864042,Moby,Resound NYC,Deutsche Grammophon,"2xLP, Album, Ltd, S/Edition, Yel",5,2023,27047832,Uncategorized,2023-05-26 08:22:30,,,
"B0003727-00, 0602498648384",Nirvana,With The Lights Out,"DGC, DGC","3xCD, Comp + DVD-V, PAL + Box",3,2004,372905,Uncategorized,2024-03-19 10:16:19,,,
DISP0004LP,Zaho De Sagazan,La Symphonie Des Éclairs,Disparate,"2xLP, Album, RE, RP",,2023,28363288,Uncategorized,2024-08-22 09:44:07,,,
DP003,La Femme (4),Psycho Tropical Berlin,Disque Pointu,"2xCD, Album, RE",,2013,5305310,Uncategorized,2025-07-17 23:53:08,,,
zod006,La Femme (4),Mystère,Disque Pointu,CD,,2016,9238738,Uncategorized,2025-07-17 23:51:37,,,
"WIGLP418, WIGLP418X",The Kills,God Games,"Domino, Domino","LP, Album, Ltd, Gre",4,2023,28710424,Uncategorized,2023-11-29 09:47:25,,,
0217872EMU,Alice Cooper,Live From The Astroturf,"Ear Music, Edel, Alive","LP, Album, Glo + DVD + Ltd, Num, RE",3,2022,24675347,Uncategorized,2023-03-18 03:35:58,,,
EES-036,Hermanos Gutiérrez (2),Sonido Cosmico,Easy Eye Sound,"LP, Album, Ltd, Pin",,2024,30970684,Uncategorized,2024-06-20 09:09:44,,,
"EKS-74007, EKL-4007",The Doors,The Doors,"Elektra, Elektra","LP, Album",4,1967,15345235,Uncategorized,2023-01-28 08:43:53,,,
0946 3861062 5,Various,La Môme (Original Soundtrack),EMI,"CD, Album",,2007,2995536,Uncategorized,2025-05-17 07:29:32,,,
"603497843510, RR1 317068",Various,Lost In Translation (Music From The Motion Picture Soundtrack),"Emperor Norton, Emperor Norton","LP, RE, RP",4,2022,21706189,Uncategorized,2023-08-25 09:22:03,,,
88875134501,The Jimi Hendrix Experience,Are You Experienced,"Experience Hendrix, Legacy, Sony Music","2xLP, Album, RE, RM, RP, 180",,2015,7577132,Uncategorized,2024-04-26 00:35:23,,,
4730367-7,Tame Impala,Currents,"Fiction Records, Caroline International, Universal Music","2xLP, Album, RE, Gat",,2022,22474430,Uncategorized,2024-07-03 08:50:34,,,
"3795299, MODVL128",Tame Impala,Innerspeaker,"Fiction Records, Caroline Records, Universal Music Group, Modular Recordings","2xLP, Album, RE",,2014,6403240,Uncategorized,2024-06-18 01:54:31,,,
"543 123-2, 543 123-2 (24)",The Cure,Bloodflowers,"Fiction Records, Polydor, Universal","CD, Album, RE",,0,3097771,Uncategorized,2025-06-27 07:13:42,,,
982 183-2,The Cure,Seventeen Seconds,"Fiction Records, Polydor, Universal","CD, Album, RE, RM",,2005,11103081,Uncategorized,2025-06-27 07:12:48,,,
982 183-8,The Cure,Pornography,"Fiction Records, Polydor, Universal","CD, Album, RE, RM",,2005,15018411,Uncategorized,2025-06-12 08:55:04,,,
9830745,The Cure,Faith,"Fiction Records, Polydor, Universal","CD, Album, RE, RM",,0,20296213,Uncategorized,2025-06-12 08:54:30,,,
357 932-2,The Cure,Wish,"Fiction Records, UMC, Polydor","CD, Album, RE, RM, 30t",,2022,25279783,Uncategorized,2025-06-27 07:12:12,,,
532 456-8,The Cure,Disintegration,"Fiction Records, Universal Music Catalogue, Polydor","CD, Album, RE, RM",,0,9610970,Uncategorized,2025-06-12 08:54:11,,,
984 001-3,The Cure,The Top,"Fiction Records, Universal Music Catalogue, Polydor","CD, Album, RE, RM",,0,22985477,Uncategorized,2025-06-12 08:54:50,,,
984 008-1,The Cure,Kiss Me Kiss Me Kiss Me,"Fiction Records, Universal, Polydor","CD, Album, RE, RM",,2012,13572067,Uncategorized,2025-06-12 08:55:26,,,
3853987,Tame Impala,The Slow Rush,"Fiction Records, Virgin","2xLP, Album, Red + 12"", Rem + 12"", One + 7"", Bon +",,2022,22806698,Uncategorized,2024-07-05 01:14:25,,,
9862886,The Cure,The Cure,"Geffen Records, This Is An I Am Recording!","CD, Album, Enh",,2004,23953730,Uncategorized,2025-06-12 08:56:18,,,
3797205,Portishead,Dummy,Go! Beat,"LP, Album, RE, 180",5,2014,6326631,Uncategorized,2023-07-19 08:58:20,,,
HDBLP064,Loraine James,Gentle Confrontation,Hyperdub,"2xLP, Album",4,2023,28386718,Uncategorized,2023-11-30 03:27:01,,,
493 259-2,Various,Baz Luhrmann's Moulin Rouge (Collector's Edition),Interscope Records,"2xCD, Comp",,2002,507476,Uncategorized,2025-07-22 00:15:30,,,
602475052876,Lady Gaga,Harlequin,Interscope Records,"LP, Album, Red",,2024,31875026,Uncategorized,2024-12-06 01:33:54,,,
0602498814390,Nine Inch Nails,With Teeth,"Interscope Records, Nothing Records","CD, Album, Dig",,2005,448222,Uncategorized,2025-05-17 06:05:37,,,
00602537181223,Lana Del Rey,Born To Die (The Paradise Edition),"Interscope Records, Polydor","2xLP, Album + LP, Album + Box, Ltd, Sli",,2012,12379459,Uncategorized,2024-09-13 03:30:34,,,
244549392,Tame Impala,Lonerism,"Island Records, Interscope Records, Fiction Records, Virgin Music Group","2xLP, Album, RE + LP + Box, S/Edition, 10 ",,2023,27194601,Uncategorized,2024-07-05 01:14:57,,,
"DBMDCD 2022, 5054197283970",David Bowie,Moonage Daydream (A Film By Brett Morgen),"ISO Records, ISO Records, Parlophone, Parlophone","2xCD, Album, Comp",5,2022,25211806,Uncategorized,2022-12-09 03:26:33,,,
885 137-6,"Jon Brion, Various",L'Amour Ouf (Soundtrack & Score),"Label Panthéon, Universal Music France","2xLP, Comp, Ltd, Red",,2024,32529465,Uncategorized,2025-04-29 09:55:26,,,
0602458993288,John Lennon,Mind Games,"Lenono Music, Universal Music Group International, Apple Records","LP, Album, RE + LP",,2024,31202122,Uncategorized,2024-10-02 03:25:42,,,
111 103-1,Various,Pulp Fiction (Music From The Motion Picture),MCA Records,"LP, Comp",4,1994,654018,Uncategorized,2023-04-26 10:35:33,,,
537 184-1,Serge Gainsbourg,Histoire De Melody Nelson,"Mercury, Mercury Music Group","2xLP, Album, RE, RM, Gat",5,2016,21125833,Uncategorized,2023-02-10 01:57:56,,,
276124-1,Serge Gainsbourg,(Best Of) Gainsbourg (Comme Un Boomerang),"Mercury, Universal Music France","2xLP, Comp, RE",5,0,19620157,Uncategorized,2023-06-09 10:28:27,,,
"74321928492, CD 92849-2",Alberto Iglesias,Hable Con Ella (Banda Sonora Original),"Milan, Milan","CD, Album",,2002,11420502,Uncategorized,2025-07-19 02:57:07,,,
MOVLP2444,The Cramps,Flamejob,Music On Vinyl,"LP, Ltd, Num, RE, Blu",4,2023,26994921,Uncategorized,2023-07-10 03:31:31,,,
CDStumm172,Moby,Play,Mute,"CD, Album",,1999,14620581,Uncategorized,2025-07-11 01:26:23,,,
"CDSTUMM130, 5016025611300",Moby,Everything Is Wrong,"Mute, Mute","CD, Album",,1995,5173804,Uncategorized,2025-07-11 01:25:27,,,
905182,The Young Gods,Super Ready / Fragmenté,Muve Recordings,"CD, Album",,2007,964168,Uncategorized,2025-05-17 05:53:03,,,
"NV811412, NV 811412",Carla Bruni,No Promises,"Naïve, Naïve","CD, Album, Enh, Dig",,2007,4258682,Uncategorized,2025-05-17 06:18:58,,,
NPR1238VINYL,Jinjer (2),Live In Los Angeles,Napalm Records,"2xLP, Album",,2024,30752877,Uncategorized,2024-05-23 09:13:36,,,
3414886,Pogo Car Crash Control,Fréquence Violence,Panenka Music,"LP, Album, Cle",,2022,23421329,Uncategorized,2024-07-05 01:16:25,,,
3479106,Pogo Car Crash Control,Negative Skills,Panenka Music,"LP, Album",,2025,33541605,Uncategorized,2025-05-26 09:18:01,,,
19658719671,Beyoncé,Renaissance,"Parkwood Entertainment, Columbia","2xLP, 180 + Box, Album, Col",,2022,24600890,Uncategorized,2024-04-08 22:51:05,,,
19658894931,Beyoncé,Cowboy Carter,"Parkwood Entertainment, Columbia, Sony Music","2xLP, Album, Ltd, Alt",,2024,30367832,Uncategorized,2024-04-12 00:40:03,,,
88985446751,Beyoncé,Lemonade,"Parkwood Entertainment, Columbia, Sony Music","2xLP, Album, RE, Yel",,2023,29324869,Uncategorized,2024-07-15 09:14:46,,,
0190295209407,Gorillaz,Song Machine Season One,Parlophone,"LP + 12"" + CD, Album, Dlx + Album, Dlx, Ltd",,2020,16093356,Uncategorized,2024-08-30 00:49:27,,,
0190295643423,Gorillaz,The Now Now,Parlophone,"LP, Album",,2018,12186161,Uncategorized,2024-08-28 04:01:27,,,
0190295851194,Gorillaz,Humanz,Parlophone,"2xLP, Album, Gat",,2017,10175557,Uncategorized,2024-08-31 02:45:07,,,
0190296300707,AIR,Premiers Symptômes,Parlophone,"12"", Comp, RE",,2022,24401120,Uncategorized,2024-04-17 09:34:32,,,
0190296713392,AIR,10 000 Hz Legend,Parlophone,"Dlx, RE, 20t + CD, Album, RE + CD + Blu-ray, Blu-r",5,2021,20849782,Uncategorized,2024-03-28 05:26:55,,,
0724384497811,AIR,Moon Safari,Parlophone,"LP, Album, RE",5,2023,27356865,Uncategorized,2023-12-25 07:32:30,,,
1899683,Vegyn,Blue Moon Safari,Parlophone,"LP, Album, RSD, Ltd, Blu",,2025,33674205,Uncategorized,2025-05-30 04:38:40,,,
5021732717696,Gorillaz,Tomorrow Comes Today,Parlophone,"12"", EP, Ltd, RE, Whi",,2025,34305388,Uncategorized,2025-06-24 03:12:03,,,
5054197174865,Gorillaz,Cracker Island,Parlophone,"Box, Dlx + LP, Album, Pea + 7"", S/Sided, Single, E",,2023,26182157,Uncategorized,2024-09-07 02:15:45,,,
5054197906770,AIR,Moon Safari,Parlophone,"CD, Album, RE, RP + CD + Blu-ray, Album, Multichan",5,2024,30067852,Uncategorized,2024-03-15 10:42:00,,,
72435 966001 1,AIR,Talkie Walkie,Parlophone,"LP, Album, RE, 180",5,2015,7066979,Uncategorized,2024-01-03 09:45:49,,,
RP1 103324,AIR,10 000 Hz Legend,Parlophone,"2xLP, Album, RE, 180",5,2015,7119823,Uncategorized,2024-01-03 09:47:56,,,
"0094638241515, PCS 3071",The Beatles,Help!,"Parlophone, Parlophone","LP, Album, RE, RM, 180",4,2012,4036953,Uncategorized,2023-05-29 09:00:46,,,
"0190295990282, DB 74766",David Bowie,Station To Station,"Parlophone, Parlophone","LP, Album, RE, RM, 180",,2017,9810328,Uncategorized,2025-04-09 11:10:27,,,
"0190295990404, DB 74761",David Bowie,Diamond Dogs,"Parlophone, Parlophone","LP, Album, RE, RM, 180",5,2017,9797722,Uncategorized,2023-10-08 10:45:55,,,
"094638241812, PCS 3075",The Beatles,Rubber Soul,"Parlophone, Parlophone","LP, Album, RE, RM, 180",5,2012,4037518,Uncategorized,2024-01-19 01:26:36,,,
"5021732489364, DBYA 50",David Bowie,Young Americans,"Parlophone, Parlophone","LP, Album, RE, RM, Hal",,2025,33338066,Uncategorized,2025-03-07 10:43:18,,,
"7243 534488 0 6, 5344880",Gorillaz,Gorillaz,"Parlophone, Parlophone","CD, Album, Enh",,2001,3944815,Uncategorized,2025-07-11 01:21:16,,,
"DBLP 377350, 5054197561153",David Bowie,Ziggy Stardust And The Spiders From Mars: The Motion Picture Soundtrack,"Parlophone, Parlophone","2xLP, Album, Ltd, RE, RM, Gol",5,2023,27942195,Uncategorized,2023-08-18 01:17:02,,,
"DBPU 50, 5054197409950",David Bowie,Pinups,"Parlophone, Parlophone","LP, Album, RE, RM, Hal",5,2023,28659493,Uncategorized,2023-10-23 00:37:45,,,
"DBRNRSLP 721, 5054197623554",David Bowie,Rock 'N' Roll Star!,"Parlophone, Parlophone",LP,,2024,30945982,Uncategorized,2024-06-14 00:55:59,,,
"0825646287390, DB69731, DB 69731",David Bowie,David Bowie,"Parlophone, Parlophone, Parlophone","LP, Album, RE, RM, Gat",4,2016,8161980,Uncategorized,2023-10-08 10:44:30,,,
"DB69732, 0825646287383, DBXL1 • DB 69732",David Bowie,The Man Who Sold The World,"Parlophone, Parlophone, Parlophone","LP, Album, RE, RM, 180",,2016,8162132,Uncategorized,2024-07-05 01:16:00,,,
"DB69734, DB 69734, 0825646287376, DBXL1",David Bowie,The Rise And Fall Of Ziggy Stardust And The Spiders From Mars,"Parlophone, Parlophone, Parlophone, Parlophone","LP, Album, RE, RM, RP, 180",5,2016,8162188,Uncategorized,2023-08-24 03:53:02,,,
PFR50UVLP,Pink Floyd,The Dark Side Of The Moon,Pink Floyd Records,"2xLP, S/Sided, Album, RE, RM, RP, Cle",,2024,30414329,Uncategorized,2024-04-24 03:25:25,Mint (M),Generic,
"PFRLP4, 0825646493166",Pink Floyd,Ummagumma,"Pink Floyd Records, Pink Floyd Records","2xLP, Album, RE, RM, Gat",,2016,8604223,Uncategorized,2025-04-28 08:31:12,,,
"7503679, 00602475036791",The Cure,Songs Of A Lost World,"Polydor, Fiction Records","CD, Album + CD + Blu-ray, Blu-ray-A, Album, Multic",,2024,32165703,Uncategorized,2025-07-01 00:30:29,,,
982 182-9,The Cure,Three Imaginary Boys,"Polydor, Fiction Records, Universal","CD, Album, RE, RM",,2005,11131681,Uncategorized,2025-06-12 08:55:51,,,
"2793424, 00602527934242",Lana Del Rey,Born To Die,"Polydor, Interscope Records","2xLP, Album, RE",5,2015,24556220,Uncategorized,2023-07-01 08:19:27,,,
"3549798, 00602435497983",Lana Del Rey,Chemtrails Over The Country Club,"Polydor, Interscope Records","LP, Album, Ltd, Yel",5,2021,17860996,Uncategorized,2023-05-10 03:30:57,,,
4748829,Lana Del Rey,Honeymoon,"Polydor, Interscope Records","2xLP, Album, Red",5,2015,7492972,Uncategorized,2023-03-18 03:37:12,,,
"4859195, 0060244891951",Lana Del Rey,Did You Know That There's A Tunnel Under Ocean Blvd,"Polydor, Interscope Records","2xLP, Album, Ltd, Gre",5,2023,26517635,Uncategorized,2023-03-28 13:57:39,,,
5758996,Lana Del Rey,Lust For Life,"Polydor, Interscope Records","2xLP, Album, RE",5,2022,25997434,Uncategorized,2023-03-31 09:24:59,,,
"535 484-3, 0600753548431",Cream (2),Disraeli Gears,"Polydor, Universal","LP, Album, RE, RP, 180",,2019,13712296,Uncategorized,2024-12-30 23:49:28,,,
COC 59100,The Rolling Stones,Sticky Fingers ,Promotone N.V.,"LP, Album, RE, RM, 180",,2022,23880710,Uncategorized,2024-11-19 02:15:45,,,
QR560,Alberto Iglesias,The Room Next Door (Original Soundtrack),Quartet Records,"CD, Album",,2024,32037206,Uncategorized,2025-07-19 02:09:26,,,
LSP-4623,David Bowie,Hunky Dory,RCA Victor,"LP, Album",5,1971,710507,Uncategorized,2023-01-28 08:41:04,,,
"RS 1001, LSP 4852",David Bowie,Aladdin Sane,"RCA Victor, RCA Victor","LP, Album, Gat",5,1973,354906,Uncategorized,2023-04-14 06:33:09,,,
88985349031,Lou Reed,Transformer,"RCA, RCA Victor","LP, Album, RE, RM",5,2018,17985520,Uncategorized,2023-05-26 08:22:09,,,
"RCV1 727421, 603497816415",Various,The Virgin Suicides (Music From The Motion Picture),"Rhino Records (2), Rhino Records (2)","LP, Comp, RE + Flexi, 7"", S/Sided + RSD, Ltd, Blu",,2025,33674139,Uncategorized,2025-07-11 10:27:51,,,
"RCVI 317029, 603497848133",Various,The Virgin Suicides (Music From The Motion Picture),"Rhino Records (2), Rhino Records (2)","LP, Comp, Ltd, RE, Rec",4,2023,28614229,Uncategorized,2024-03-25 10:16:45,,,
"RCV1 726985, 081227813949",Alice Cooper,Muscle Of Love,"Rhino Records (2), Warner Records","2xLP, Album, Dlx, Ltd, RE, RM, Pin",,2024,32251374,Uncategorized,2024-11-12 02:50:49,,,
"R2 725031, 603497832415",Alice Cooper,Billion Dollar Babies,"Rhino Records (2), Warner Records, Rhino Records (2), Warner Records","CD, Album, RE, RM + CD",5,2024,30031852,Uncategorized,2024-03-08 01:51:59,,,
554 646-1,The Rolling Stones,Hackney Diamonds,"Rolling Stones Records, Polydor","LP, Album, Ltd, Pur",4,2023,28606537,Uncategorized,2023-10-20 00:59:08,,,
"COC 69100, 0602508773211",The Rolling Stones,Exile On Main St,"Rolling Stones Records, Rolling Stones Records","2xLP, Album, RE, RM, 180",,2022,28642858,Uncategorized,2024-11-19 02:15:06,,,
"4844231, 00602448442314",The Rolling Stones,Grrr Live! ,"Rolling Stones Records, Rolling Stones Records, Mercury Studios (5), Mercury Studios (5), Universal Music Group, Universal Music Group","3xLP, Album, Ltd, S/Edition, Whi",5,2023,26053582,Uncategorized,2023-07-02 10:28:12,,,
RTRADLP166,The Libertines,The Libertines,Rough Trade,"LP, Album, RE, RP",4,2021,21138451,Uncategorized,2024-02-28 08:41:02,,,
025 071 563-9,Quincy Jones,Big Band Bossa Nova,Saga,"LP, RM",,2020,16043809,Uncategorized,2024-05-01 07:30:13,,,
556-197-8,Chet Baker,My Funny Valentine,Sélection FNAC,"LP, Comp, RE, RM",,2023,30316805,Uncategorized,2024-05-01 07:30:41,,,
SGB50LP,Roger Waters,The Dark Side Of The Moon Redux,"SGB Music Limited, Cooking Vinyl","2xLP, Album, Blu",5,2023,28510447,Uncategorized,2023-11-20 03:30:30,,,
TRANS509CD,Arlo Parks,Collapsed In Sunbeams,Transgressive Records,"CD, Album",4,2021,17155057,Uncategorized,2022-12-22 14:46:45,,,
TRANS509X,Arlo Parks,Collapsed In Sunbeams,"Transgressive Records, Beatnik","LP, Album, Ltd, Red",4,2021,17151046,Uncategorized,2023-04-20 09:19:19,,,
TWOGTL 130-12,The Young Gods,Appear Disappear,Two Gentlemen Records,"LP, Cre + CD + Album, Ltd",,2025,34203484,Uncategorized,2025-06-13 02:56:27,,,
832 231-2,Jane Birkin,Vol.1,"U.L.M TV Market, Universal","CD, Comp, RE, RM",,2003,6257522,Uncategorized,2025-05-17 07:30:02,,,
485 387-8,Feu ! Chatterton,Live À Paris (Palais D'Argile Tour 2022),Universal Music France,2xCD,4,2022,25377520,Uncategorized,2023-02-04 11:03:22,,,
UCCU-90007,Martial Solal,À Bout De Souffle (Bande Originale Du Film),"Universal Music France, Universal Music Jazz France, EmArcy","CD, Album, Comp, RE",,2013,15829122,Uncategorized,2025-06-25 09:13:13,,,
"R2 725876 / 603497828852, 00600753993149",Deep Purple,Machine Head,"Universal Music Group, Universal Music Group","LP, Album, RE, Pur + CD, Album, RE, RM + CD, Album",5,2024,30239906,Uncategorized,2024-03-30 05:45:32,,,
"6580358, 00602465803587",The Verve,This Is Music: The Singles,"Universal Music Recordings, Virgin, EMI, Universal Music Recordings, Virgin, EMI","2xLP, Comp, RE",,2025,32916609,Uncategorized,2025-01-30 08:47:58,,,
450 118-6,Feu ! Chatterton,Palais D'Argile,Universo Em Fogo,"2xCD, Album, Dlx, RE",4,2021,21141472,Uncategorized,2022-12-09 04:31:24,,,
3786617,Lana Del Rey,Ultraviolence,"Vertigo, Universal Music Group","2xLP, Album, Dlx, 180",5,2014,5790430,Uncategorized,2023-01-28 08:36:51,,,
0602517084186,Various,Marie Antoinette (Original Motion Picture Soundtrack),"Verve Forecast, Polydor","2xCD, Comp",,2006,835935,Uncategorized,2025-07-16 08:42:36,,,
6022046441,Mass Hysteria (4),Tenace - Part 1,Verycords,"LP, Album, Ltd, Whi",3,2023,27204540,Uncategorized,2023-06-10 01:52:53,,,
900051,The Velvet Underground & Nico (3),The Velvet Underground & Nico,Vinyl Lovers,"LP, Album, RE, Pee",,2008,1839185,Uncategorized,2024-08-12 14:22:53,,,
7243 8101092 1,Various,More In The Mood For Love (More Music From And Inspired By The Motion Picture),Virgin,"CD, Comp",,2001,4661567,Uncategorized,2025-05-17 06:38:44,,,
0602557048414,Queen,Greatest Hits,Virgin EMI Records,"2xLP, Comp, RE, RM, Gat",4,2016,9371072,Uncategorized,2024-01-05 09:03:59,,,
0602557048445,Queen,Greatest Hits II,Virgin EMI Records,"2xLP, Comp, RE, RM, Gat",4,2016,9370710,Uncategorized,2023-12-25 07:29:38,,,
581796-5,Feu ! Chatterton,La Grande Magie,Virgin Music,CD,,2023,30548113,Uncategorized,2025-07-24 08:50:57,,,
0946 3 83761 2 5,AIR,Pocket Symphony,"Virgin Music, Aircheology","CD, Album, Enh",,2007,10571461,Uncategorized,2025-05-17 05:56:36,,,
"7243 8488482 6, CDV 2910",AIR,Original Motion Picture Score For The Virgin Suicides,"Virgin, Virgin","CD, Album, RE, IMS",,0,3303964,Uncategorized,2024-04-14 11:02:46,,,
3455956,Various,Tarantino Sounds - A Tribute To Quentin Tarantino,Wagram Music,"LP, Comp, RM",,2024,31001590,Uncategorized,2024-06-30 08:16:25,,,
